{
  "id": "0183d245-b5c1-2a6d-5e37-1b831d765c5d",
  "account": "0187c66e-e7e5-811c-b006-2232f00f426a",
  "employer": "Whole Goods",
  "created_at": "2023-04-27T07:02:01.279Z",
  "updated_at": "2023-04-27T07:02:01.279Z",
  "status": "completed",
  "type": "hourly",
  "start_datetime": "2023-04-26T00:00:00Z",
  "end_datetime": "2023-04-26T08:00:00Z",
  "all_datetimes": {
    "shift_start": "2023-04-26T00:00:00Z",
    "shift_end": "2023-04-26T08:00:00Z",
    "breaks": [
      {
        "break_start": "2023-04-26T03:36:00Z",
        "break_end": "2023-04-26T04:24:00Z"
      }
    ]
  },
  "hours": "7.2",
  "timezone": "America/New_York",
  "location": "302 East N St, New York, NY 10014, US",
  "metadata": {}
}